{
  "$schema": "../schemas/source.schema.json",
  "record_type": "source_registry",
  "registry_id": "REGISTRY-SOC2",
  "version": "0.1.0",
  "last_reviewed": "2026-08-11",
  "description": "Canonical registry of every source the DriftGuard SOC 2 knowledge base may cite. All knowledge records reference sources by source_id only; bibliographic detail lives here and nowhere else.",
  "authority_tiers": [
    {
      "tier": 1,
      "key": "authoritative_requirement",
      "name": "Authoritative requirement",
      "definition": "Text that determines whether a SOC 2 examination or report conforms. Issued by a standard setter with authority over SOC 2 (AICPA ASEC / ASB). Only these sources may be described as required.",
      "citation_obligation": "Mandatory. Any statement using 'must', 'is required', or 'the criteria state' MUST cite a tier-1 source."
    },
    {
      "tier": 2,
      "key": "official_guidance",
      "name": "Official guidance",
      "definition": "Non-binding interpretive material published by the standard setter (AICPA guides, description criteria, points of focus commentary). Explains how criteria are commonly applied; is not itself a requirement.",
      "citation_obligation": "Required for interpretive claims. Must be labelled as guidance, never as requirement."
    },
    {
      "tier": 3,
      "key": "industry_guidance",
      "name": "Industry guidance",
      "definition": "Recognised external frameworks and standards used to operationalise criteria (COSO, NIST, ISO, CIS). Useful for control design and cross-framework mapping. Carries no SOC 2 authority.",
      "citation_obligation": "Required when used as the basis of a mapping or a control-design recommendation."
    },
    {
      "tier": 4,
      "key": "auditor_interpretation",
      "name": "Auditor interpretation",
      "definition": "Practitioner judgement about how service auditors typically evaluate a criterion, including common testing approaches and evidence expectations. Varies by firm and engagement.",
      "citation_obligation": "Must be explicitly labelled as interpretation and hedged ('auditors commonly', 'is typically expected'). Never phrased as a requirement."
    },
    {
      "tier": 5,
      "key": "driftguard_best_practice",
      "name": "DriftGuard best practice",
      "definition": "DriftGuard's own opinionated recommendation. Represents product judgement, not external authority.",
      "citation_obligation": "Must be attributed to DriftGuard and clearly separated from criteria language."
    }
  ],
  "sources": [
    {
      "source_id": "SRC-AICPA-TSC-2017-R2022",
      "title": "TSP Section 100, 2017 Trust Services Criteria for Security, Availability, Processing Integrity, Confidentiality, and Privacy (With Revised Points of Focus - 2022)",
      "publisher": "AICPA Assurance Services Executive Committee (ASEC)",
      "authority_tier": 1,
      "authority_key": "authoritative_requirement",
      "edition": "2017 criteria, points of focus revised 2022",
      "url": "https://www.aicpa-cima.com/resources/download/2017-trust-services-criteria-with-revised-points-of-focus-2022",
      "citation_hint": "Cite individual criteria by identifier, e.g. TSC CC6.1.",
      "notes": "The 2022 revision updated points of focus only; the criteria themselves are unchanged since 2017. Points of focus are not requirements and need not be individually addressed.",
      "verification_status": "verified",
      "verified_on": "2026-08-11"
    },
    {
      "source_id": "SRC-AICPA-SSAE-21",
      "title": "Statement on Standards for Attestation Engagements No. 21, Direct Examination Engagements",
      "publisher": "AICPA Auditing Standards Board",
      "authority_tier": 1,
      "authority_key": "authoritative_requirement",
      "edition": "Issued September 2020; effective for reports dated on or after June 15, 2022",
      "url": "https://www.aicpa-cima.com/resources/download/aicpa-statement-on-standards-for-attestation-engagements-no-21",
      "citation_hint": "Cite for the attestation standard governing SOC 2 examinations.",
      "notes": "Created AT-C section 206 (no SOC impact), superseded AT-C section 205 (retitled 'Assertion-Based Examination Engagements') and amended AT-C section 105. Introduced no substantive change to SOC 2 report content.",
      "verification_status": "verified",
      "verified_on": "2026-08-11"
    },
    {
      "source_id": "SRC-AICPA-ATC-105",
      "title": "AT-C Section 105, Concepts Common to All Attestation Engagements",
      "publisher": "AICPA Auditing Standards Board",
      "authority_tier": 1,
      "authority_key": "authoritative_requirement",
      "url": "https://www.aicpa-cima.com/",
      "citation_hint": "Cite for practitioner independence, competence, and general attestation requirements.",
      "notes": "As amended by SSAE No. 21.",
      "verification_status": "verified",
      "verified_on": "2026-08-11"
    },
    {
      "source_id": "SRC-AICPA-ATC-205",
      "title": "AT-C Section 205, Assertion-Based Examination Engagements",
      "publisher": "AICPA Auditing Standards Board",
      "authority_tier": 1,
      "authority_key": "authoritative_requirement",
      "url": "https://www.aicpa-cima.com/",
      "citation_hint": "Cite for examination-level evidence, opinion, and modification requirements.",
      "notes": "Superseded the SSAE No. 18 version of AT-C 205 and was retitled by SSAE No. 21.",
      "verification_status": "verified",
      "verified_on": "2026-08-11"
    },
    {
      "source_id": "SRC-AICPA-DC-200",
      "title": "DC Section 200, 2018 Description Criteria for a Description of a Service Organization's System in a SOC 2 Report",
      "publisher": "AICPA",
      "authority_tier": 1,
      "authority_key": "authoritative_requirement",
      "url": "https://www.aicpa-cima.com/",
      "citation_hint": "Cite for what management's system description must contain.",
      "notes": "Distinct from the trust services criteria: the description criteria govern the system description, the trust services criteria govern the controls. VERIFY the enumeration and count of individual DC items against the published text before asserting them.",
      "verification_status": "needs_verification"
    },
    {
      "source_id": "SRC-AICPA-SOC2-GUIDE",
      "title": "AICPA Guide, SOC 2: Reporting on an Examination of Controls at a Service Organization Relevant to Security, Availability, Processing Integrity, Confidentiality, or Privacy",
      "publisher": "AICPA",
      "authority_tier": 2,
      "authority_key": "official_guidance",
      "url": "https://www.aicpa-cima.com/",
      "citation_hint": "Cite for interpretive guidance on scoping, testing, and reporting.",
      "notes": "Updated periodically. Confirm the edition in force before quoting specific paragraph numbers.",
      "verification_status": "needs_verification"
    },
    {
      "source_id": "SRC-COSO-2013",
      "title": "Internal Control - Integrated Framework (2013)",
      "publisher": "Committee of Sponsoring Organizations of the Treadway Commission (COSO)",
      "authority_tier": 2,
      "authority_key": "official_guidance",
      "url": "https://www.coso.org/",
      "citation_hint": "Cite for the 17 internal control principles underpinning common criteria CC1-CC5.",
      "notes": "Incorporated by reference into the trust services criteria; the common criteria are organised around the COSO principles.",
      "verification_status": "verified",
      "verified_on": "2026-08-11"
    },
    {
      "source_id": "SRC-NIST-SP800-53R5",
      "title": "NIST SP 800-53 Revision 5, Security and Privacy Controls for Information Systems and Organizations",
      "publisher": "NIST",
      "authority_tier": 3,
      "authority_key": "industry_guidance",
      "url": "https://csrc.nist.gov/pubs/sp/800/53/r5/upd1/final",
      "citation_hint": "Cite for cross-framework control mappings and implementation detail.",
      "verification_status": "verified",
      "verified_on": "2026-08-11"
    },
    {
      "source_id": "SRC-NIST-CSF-2.0",
      "title": "NIST Cybersecurity Framework (CSF) 2.0",
      "publisher": "NIST",
      "authority_tier": 3,
      "authority_key": "industry_guidance",
      "url": "https://www.nist.gov/cyberframework",
      "citation_hint": "Cite for outcome-level cross-framework mapping.",
      "verification_status": "verified",
      "verified_on": "2026-08-11"
    },
    {
      "source_id": "SRC-ISO-27001-2022",
      "title": "ISO/IEC 27001:2022, Information security, cybersecurity and privacy protection - Information security management systems - Requirements",
      "publisher": "ISO/IEC",
      "authority_tier": 3,
      "authority_key": "industry_guidance",
      "url": "https://www.iso.org/standard/27001",
      "citation_hint": "Cite Annex A control identifiers for cross-framework mapping.",
      "notes": "Copyrighted text. Do not reproduce control wording in the knowledge base; reference identifiers only.",
      "verification_status": "verified",
      "verified_on": "2026-08-11"
    },
    {
      "source_id": "SRC-CIS-CONTROLS-V8",
      "title": "CIS Critical Security Controls, Version 8",
      "publisher": "Center for Internet Security",
      "authority_tier": 3,
      "authority_key": "industry_guidance",
      "url": "https://www.cisecurity.org/controls",
      "citation_hint": "Cite safeguard identifiers for implementation-level guidance.",
      "verification_status": "verified",
      "verified_on": "2026-08-11"
    },
    {
      "source_id": "SRC-DG-AUDITOR-PRACTICE",
      "title": "DriftGuard Auditor Practice Notes",
      "publisher": "DriftGuard",
      "authority_tier": 4,
      "authority_key": "auditor_interpretation",
      "citation_hint": "Cite for statements about how service auditors commonly test or what they typically expect.",